{
  "$schema": "https://json-schema.org/draft/2020-12/schema",
  "$id": "https://ai-dev.local/schemas/tool-definition.schema.json",
  "title": "ToolDefinition",
  "type": "object",
  "additionalProperties": false,
  "required": [
    "name",
    "version",
    "description",
    "executor",
    "inputSchema",
    "resultSchema",
    "errors"
  ],
  "properties": {
    "name": {
      "type": "string",
      "pattern": "^[a-z][a-z0-9_]*$"
    },
    "version": {
      "type": "string",
      "pattern": "^[0-9]+\\.[0-9]+\\.[0-9]+$"
    },
    "description": {
      "type": "string",
      "minLength": 1
    },
    "executor": {
      "type": "object",
      "additionalProperties": false,
      "required": [
        "type",
        "path"
      ],
      "properties": {
        "type": {
          "type": "string",
          "enum": [
            "python"
          ]
        },
        "path": {
          "type": "string",
          "minLength": 1
        }
      }
    },
    "inputSchema": {
      "type": "object"
    },
    "resultSchema": {
      "type": "object"
    },
    "errors": {
      "type": "array",
      "minItems": 1,
      "items": {
        "type": "object",
        "additionalProperties": false,
        "required": [
          "code",
          "description"
        ],
        "properties": {
          "code": {
            "type": "string",
            "pattern": "^[a-z][a-z0-9_]*$"
          },
          "description": {
            "type": "string",
            "minLength": 1
          }
        }
      }
    }
  }
}
